{
  "$schema":"https://json-schema.org/draft/2020-12/schema",
  "$defs":{"digest":{"type":"string","pattern":"^sha256:[0-9a-f]{64}$"},"timestamp":{"type":"string","format":"date-time","pattern":"^[0-9]{4}-[0-9]{2}-[0-9]{2}T[0-9]{2}:[0-9]{2}:[0-9]{2}(\\.[0-9]{1,9})?Z$"}},
  "type":"object","additionalProperties":false,
  "required":["schema_version","kind","experiment_id","status","route","statistical_verdict","gate_claim","preregistration_digest","corpus_manifest_digest","registration_digest","runtime_manifest_digest","materialization_receipt_digest","materialization_receipt_count","measured_started_at","measured_ended_at","reported_at","units","measured_trials","terminal_trials","class_analyses","guardrails_passed","external_blockers"],
  "properties":{
    "schema_version":{"const":"2.0"},"kind":{"const":"m005_w07_measured_report"},"experiment_id":{"const":"m005-w07-rust-registry-v6"},
    "status":{"enum":["PASS_LOCAL_CALIBRATION","FAIL_LOCAL_CALIBRATION"]},"route":{"const":"LOCAL_SANDBOX_NOT_TRUSTED"},
    "statistical_verdict":{"enum":["PASS","FAIL"]},"gate_claim":{"const":"NONE_BLOCKED_EXTERNAL"},
    "preregistration_digest":{"$ref":"#/$defs/digest"},"corpus_manifest_digest":{"$ref":"#/$defs/digest"},"registration_digest":{"$ref":"#/$defs/digest"},"runtime_manifest_digest":{"$ref":"#/$defs/digest"},"materialization_receipt_digest":{"$ref":"#/$defs/digest"},"materialization_receipt_count":{"const":72},
    "measured_started_at":{"$ref":"#/$defs/timestamp"},"measured_ended_at":{"$ref":"#/$defs/timestamp"},"reported_at":{"$ref":"#/$defs/timestamp"},
    "units":{"const":72},"measured_trials":{"const":504},"terminal_trials":{"const":504},
    "class_analyses":{"type":"array","minItems":3,"maxItems":3,"items":{"type":"object","additionalProperties":false,"required":["repository_class","pairs","l_successes","c_successes","estimate","confidence_level","lower","upper","passed","error"],"properties":{"repository_class":{"enum":["small","medium","large"]},"pairs":{"const":24},"l_successes":{"type":"integer","minimum":0,"maximum":24},"c_successes":{"type":"integer","minimum":0,"maximum":24},"estimate":{"type":["number","null"],"minimum":-1,"maximum":1},"confidence_level":{"type":["number","null"],"minimum":0,"maximum":1},"lower":{"type":["number","null"],"minimum":-1,"maximum":1},"upper":{"type":["number","null"],"minimum":-1,"maximum":1},"passed":{"type":"boolean"},"error":{"type":["string","null"],"maxLength":4096}}}},
    "guardrails_passed":{"type":"boolean"},"external_blockers":{"const":["G03","G04","BLK-14","EXT-15"]}
  }
}
