{
  "schema_version": "2.0",
  "kind": "m005_w07_measured_report",
  "experiment_id": "m005-w07-rust-registry-v6",
  "status": "FAIL_LOCAL_CALIBRATION",
  "route": "LOCAL_SANDBOX_NOT_TRUSTED",
  "statistical_verdict": "FAIL",
  "gate_claim": "NONE_BLOCKED_EXTERNAL",
  "preregistration_digest": "sha256:fcb2ec7d1ee42bd305f26afd14c37d202ad13fa4be468e02c5bec7689b304795",
  "corpus_manifest_digest": "sha256:edb275e46eae8a74f3beed1144c64ab9e3117a21dfa522cc0be005d201fbd35e",
  "registration_digest": "sha256:97e63cc75b1be82c06c73d5b19ca7d46b9f502e653e8d83a412ef773a37f94ad",
  "runtime_manifest_digest": "sha256:3802baabdb8b14c85170715febe1029c884f470ac9018f538ee94fc566859b1b",
  "materialization_receipt_digest": "sha256:3e53bf9163334679ac47076df28316274e5bd77d65819741984b7b5112ac2d87",
  "materialization_receipt_count": 72,
  "measured_started_at": "2026-07-31T14:15:00.803808Z",
  "measured_ended_at": "2026-07-31T14:36:58.221982Z",
  "reported_at": "2026-07-31T14:38:56.625928Z",
  "units": 72,
  "measured_trials": 504,
  "terminal_trials": 504,
  "class_analyses": [
    {
      "repository_class": "small",
      "pairs": 24,
      "l_successes": 21,
      "c_successes": 24,
      "estimate": 0.125,
      "confidence_level": 0.9833333333333333,
      "lower": -0.1904967972359728,
      "upper": 0.3938444781953845,
      "passed": false,
      "error": null
    },
    {
      "repository_class": "medium",
      "pairs": 24,
      "l_successes": 14,
      "c_successes": 16,
      "estimate": 0.08333333333333333,
      "confidence_level": 0.9833333333333333,
      "lower": -0.20016139242638326,
      "upper": 0.3389227763324406,
      "passed": false,
      "error": null
    },
    {
      "repository_class": "large",
      "pairs": 24,
      "l_successes": 18,
      "c_successes": 18,
      "estimate": 0.0,
      "confidence_level": 0.9833333333333333,
      "lower": -0.20416225761354695,
      "upper": 0.20416225761354695,
      "passed": false,
      "error": null
    }
  ],
  "guardrails_passed": false,
  "external_blockers": [
    "G03",
    "G04",
    "BLK-14",
    "EXT-15"
  ]
}
